[
  { "id": "prod_wedge_sm10_50",  "name": "Titleist Vokey SM10 50.08F",              "category": "Clubs",           "sku": "TIT-SM10-50",  "price": 189.00, "cost": 110.00, "stock":  8, "reorderLevel":  3 },
  { "id": "prod_wedge_sm10_54",  "name": "Titleist Vokey SM10 54.10S",              "category": "Clubs",           "sku": "TIT-SM10-54",  "price": 189.00, "cost": 110.00, "stock":  6, "reorderLevel":  3 },
  { "id": "prod_wedge_sm10_58",  "name": "Titleist Vokey SM10 58.06K",              "category": "Clubs",           "sku": "TIT-SM10-58",  "price": 189.00, "cost": 110.00, "stock":  9, "reorderLevel":  3 },
  { "id": "prod_wedge_sm10_60",  "name": "Titleist Vokey SM10 60.04L",              "category": "Clubs",           "sku": "TIT-SM10-60",  "price": 189.00, "cost": 110.00, "stock":  4, "reorderLevel":  3 },
  { "id": "prod_wedge_rtx6_52",  "name": "Cleveland RTX 6 ZipCore 52°",             "category": "Clubs",           "sku": "CLV-RTX6-52",  "price": 169.99, "cost":  95.00, "stock":  5, "reorderLevel":  3 },
  { "id": "prod_wedge_rtx6_56",  "name": "Cleveland RTX 6 ZipCore 56°",             "category": "Clubs",           "sku": "CLV-RTX6-56",  "price": 169.99, "cost":  95.00, "stock":  6, "reorderLevel":  3 },
  { "id": "prod_wedge_rtx6_60",  "name": "Cleveland RTX 6 ZipCore 60°",             "category": "Clubs",           "sku": "CLV-RTX6-60",  "price": 169.99, "cost":  95.00, "stock":  2, "reorderLevel":  3 },
  { "id": "prod_wedge_t24_54",   "name": "Mizuno T24 White Satin 54°",              "category": "Clubs",           "sku": "MIZ-T24-54",   "price": 179.99, "cost": 102.00, "stock":  4, "reorderLevel":  2 },
  { "id": "prod_wedge_jaws_60",  "name": "Callaway Jaws Raw 60°",                    "category": "Clubs",           "sku": "CAL-JAWS-60",  "price": 169.99, "cost":  98.00, "stock":  3, "reorderLevel":  2 },
  { "id": "prod_putter_phantom", "name": "Scotty Cameron Phantom 5 Putter",         "category": "Clubs",           "sku": "TIT-PH5",      "price": 499.00, "cost": 310.00, "stock":  2, "reorderLevel":  1 },
  { "id": "prod_aid_puttout",    "name": "PuttOut Pressure Putt Trainer",           "category": "Accessories",     "sku": "AID-PUTTOUT",  "price":  29.99, "cost":  12.00, "stock": 18, "reorderLevel":  6 },
  { "id": "prod_aid_mirror",     "name": "EyeLine Golf Putting Mirror",             "category": "Accessories",     "sku": "AID-EYELINE",  "price":  44.95, "cost":  20.00, "stock": 12, "reorderLevel":  4 },
  { "id": "prod_aid_align",      "name": "Tour Stick Alignment Pair",               "category": "Accessories",     "sku": "AID-ALIGN-2",  "price":  19.99, "cost":   6.00, "stock": 30, "reorderLevel":  8 },
  { "id": "prod_aid_planemate",  "name": "PlaneMate Swing Trainer",                 "category": "Accessories",     "sku": "AID-PLNMATE",  "price": 169.00, "cost":  85.00, "stock":  6, "reorderLevel":  2 },
  { "id": "prod_aid_superspeed", "name": "SuperSpeed Golf Training Set",            "category": "Accessories",     "sku": "AID-SSPEED",   "price": 199.00, "cost":  98.00, "stock":  4, "reorderLevel":  2 },
  { "id": "prod_ball_prov1",     "name": "Titleist Pro V1 Dozen",                   "category": "Balls",           "sku": "TIT-PV1-12",   "price":  54.99, "cost":  36.00, "stock": 36, "reorderLevel": 12 },
  { "id": "prod_ball_prov1x",    "name": "Titleist Pro V1x Dozen",                  "category": "Balls",           "sku": "TIT-PV1X-12",  "price":  54.99, "cost":  36.00, "stock": 24, "reorderLevel": 12 },
  { "id": "prod_ball_chrome",    "name": "Callaway Chrome Tour Dozen",              "category": "Balls",           "sku": "CAL-CHT-12",   "price":  54.99, "cost":  36.00, "stock": 18, "reorderLevel": 12 },
  { "id": "prod_ball_tp5",       "name": "TaylorMade TP5 Dozen",                    "category": "Balls",           "sku": "TM-TP5-12",    "price":  54.99, "cost":  36.00, "stock": 14, "reorderLevel": 12 },
  { "id": "prod_glove_fjptl_l",  "name": "FootJoy Pure Touch Limited Glove L",      "category": "Accessories",     "sku": "FJ-PTL-L",     "price":  36.00, "cost":  16.00, "stock": 10, "reorderLevel":  6 },
  { "id": "prod_glove_titl_m",   "name": "Titleist Players Glove M",                "category": "Accessories",     "sku": "TIT-PLR-M",    "price":  25.00, "cost":  11.00, "stock": 14, "reorderLevel":  8 },
  { "id": "prod_tee_iron",       "name": "Pride Performance Iron Tees 1.5\" (75pk)", "category": "Accessories",     "sku": "PRD-PRF-150",  "price":   3.99, "cost":   1.60, "stock": 60, "reorderLevel": 24 },
  { "id": "prod_tee_castle",     "name": "Martini Castle Tees 2.75\" (8pk)",         "category": "Accessories",     "sku": "MTN-CSTL-275", "price":   8.99, "cost":   3.20, "stock": 40, "reorderLevel": 16 },
  { "id": "prod_polo_acad",      "name": "Greenside Academy Performance Polo",      "category": "Apparel",         "sku": "APP-POLO-AC",  "price":  85.00, "cost":  40.00, "stock": 22, "reorderLevel":  8 },
  { "id": "prod_qzip_acad",      "name": "Greenside Academy Quarter Zip",           "category": "Apparel",         "sku": "APP-QZIP-AC",  "price":  98.00, "cost":  48.00, "stock": 14, "reorderLevel":  6 },
  { "id": "prod_cap_acad",       "name": "Greenside Academy Performance Cap",       "category": "Apparel",         "sku": "APP-CAP-AC",   "price":  32.00, "cost":  12.00, "stock": 28, "reorderLevel": 10 },
  { "id": "prod_water",          "name": "Spring Water 16oz",                        "category": "Food & Beverage", "sku": "FB-H2O-16",    "price":   2.50, "cost":   0.55, "stock":120, "reorderLevel": 36 },
  { "id": "prod_sport_drink",    "name": "Electrolyte Sport Drink 20oz",             "category": "Food & Beverage", "sku": "FB-SPORT-20",  "price":   3.95, "cost":   1.10, "stock": 72, "reorderLevel": 24 },
  { "id": "prod_energy_bar",     "name": "Performance Energy Bar",                   "category": "Food & Beverage", "sku": "FB-BAR-PERF",  "price":   3.50, "cost":   1.05, "stock": 60, "reorderLevel": 24 }
]
